{
  "schema_version": 2,
  "id": "cytochrome-c",
  "title": "Cytochrome c: a real protein tree",
  "alphabet": "protein",
  "data": {
    "kind": "embedded",
    "fasta": ">human\n-------MGDVEKGKKIFIMKCSQCHTVEKGGKHKTGPNLHGLFGRKTGQAPGYSYTAANKNKGIIWGEDTLMEYLENPKKYIPGTKMIFVGIKKKEERADLIAYLKKATNE\n>horse\n-------MGDVEKGKKIFVQKCAQCHTVEKGGKHKTGPNLHGLFGRKTGQAPGFTYTDANKNKGITWKEETLMEYLENPKKYIPGTKMIFAGIKKKTEREDLIAYLKKATNE\n>chicken\n-------MGDIEKGKKIFVQKCSQCHTVEKGGKHKTGPNLHGLFGRKTGQAEGFSYTDANKNKGITWGEDTLMEYLENPKKYIPGTKMIFAGIKKKSERVDLIAYLKDATSK\n>zebrafish\n-------MGDVEKGKKVFVQKCAQCHTVENGGKHKVGPNLWGLFGRKTGQAEGFSYTDANKSKGIVWGEDTLMEYLENPKKYIPGTKMIFAGIKKKGERADLIAYLKSATS-\n>drosophila\n---MGVPAGDVEKGKKLFVQRCAQCHTVEAGGKHKVGPNLHGLIGRKTGQAAGFAYTDANKAKGITWNEDTLFEYLENPKKYIPGTKMIFAGLKKPNERGDLIAYLKSATK-\n>wheat\nASFSEAPPGNPDAGAKIFKTKCAQCHTVDAGAGHKQGPNLHGLFGRQSGTTAGYSYSAANKNKAVEWEENTLYDYLLNPKKYIPGTKMVFPGLKKPQDRADLIAYLKKATSS\n>yeast\n--MTEFKAGSAKKGATLFKTRCLQCHTVEKGGPHKVGPNLHGIFGRHSGQAEGYSYTDANIKKNVLWDENNMSEYLTNPKKYIPGTKMAFGGLKKEKDRNDLITYLKKACE-\n>neurospora\n---MGFSAGDSKKGANLFKTRCAQCHTLEEGGGNKIGPALHGLFGRKTGSVDGYAYTDANKQKGITWDENTLFEYLENPKKYIPGTKMAFGGLKKDKDRNDIITFMKEATA-",
    "source": {
      "citation": "UniProt Consortium, UniProtKB (uniprot.org); aligned with MAFFT v7.525",
      "license": "CC BY 4.0",
      "accessions": ["P99999", "P00004", "P67881", "Q6IQM2", "P84029", "P00068", "P00044", "P00048"]
    }
  },
  "reference": {
    "newick": "(wheat:1,((yeast:1,neurospora:1):1,(drosophila:1,(zebrafish:1,(chicken:1,(horse:1,human:1):1):1):1):1):1);",
    "kind": "classification"
  },
  "analysis": { "correction": "JTT", "method": "NJ" },
  "locked": ["analysis.method"],
  "prompts": [
    {
      "at_step": 1,
      "type": "note",
      "concept": "This is real data: cytochrome c, a ~110-site protein found in almost every eukaryote, from eight species spanning the deepest splits in the tree of life — human, horse, chicken, zebrafish, Drosophila, wheat, yeast and Neurospora. The sequences come from UniProt (CC BY 4.0) and were aligned with MAFFT; the reference panel shows the accepted classification, not a known true tree.",
      "math": "Cytochrome c is small and ancient: even the deepest pair (wheat–Neurospora) carries a JTT distance of only ~0.64 substitutions per site — long, but well below the saturation ceiling."
    },
    {
      "at_step": 1,
      "type": "predict_pair",
      "concept": "The matrix shows JTT-corrected distances. The smallest cell is horse–chicken at 0.119 — yet that pair will not join first, because NJ scores pairs by Q, which also counts how far each lineage is from everything else. Which two species join first?",
      "math": "NJ joins the pair minimizing Q(i,j) = (n−2)·d(i,j) − R_i − R_j. The two fungi sit far from every animal and plant — their large row sums R pull their Q below every other pair's.",
      "reveal": "The two fungi join first: yeast–Neurospora at 0.464 wins on Q even though it is nowhere near the smallest distance. The \"Show horse vs chicken\" button below opens \"How was this distance computed?\" for that pair: at 0.119 it is the matrix minimum, but each vertebrate stays close to all the others, so their pair scores worse on Q.",
      "reveal_pair": ["horse", "chicken"]
    },
    {
      "at_step": 3,
      "type": "note",
      "concept": "Two joins in, the deepest divide is drawn: the fungi paired, wheat attached to them, and the insect is about to join nearest that split on the animal side. Read it as an unrooted tree — the split it found is \"animals versus plants and fungi\". Root it on wheat, as the reference does, and the same split reads differently: plants out first, with fungi and animals as each other's closest relatives — the opisthokonts.",
      "math": "A tree read as unrooted has no direction: the same bipartition supports \"plants + fungi\" versus \"animals\", and choosing where the root sits on it is what makes plants the outgroup and Opisthokonta a clade."
    },
    {
      "at_step": 5,
      "type": "note",
      "concept": "The non-animal side is finished and the mammals have paired — only the vertebrates are left to order: human+horse, chicken and zebrafish. Look at the matrix corner they share: every distance among the four vertebrates is 0.10–0.18, a sliver next to the 0.45–0.64 crossing the deep divide. The last joins make the weakest decisions in the whole tree.",
      "math": "Within-vertebrate distances run 0.10–0.18 against 0.45–0.64 across the deep divide. The tree has plenty of signal for the old splits and very little for the young ones."
    },
    {
      "at_step": 7,
      "type": "note",
      "concept": "The tree is complete — and it matches the accepted classification in every clade. We draw it with the plant as the outgroup, as biologists usually do. NJ itself builds an unrooted tree, so where the root goes comes from outside knowledge, not from these sequences. Drawn that way, fungi and animals are closest relatives, and inside the animals the vertebrates and mammals group together. It still earned the vertebrates the hard way: the smallest distance in the whole matrix is horse–chicken at 0.119, even though horse is much closer to human — with a short, slowly evolving protein a handful of substitutions decides which pair looks closest. NJ recovers anyway because it joins by Q — relative closeness — not by raw distance.",
      "math": "RF counts clades present in one tree but not the other: here every clade of the classification is present — nothing missing, nothing extra. The Q score is what rescued the vertebrates; the smallest distance was not the truest pair."
    }
  ]
}
